title,description
Organizar reunião,Agendar uma reunião com a equipe para discutir os próximos passos do projeto.
Preparar apresentação,Criar slides para a apresentação da próxima semana.
Revisar relatório,Analisar e revisar o relatório trimestral antes da entrega.
Atualizar documentação,Manter a documentação do projeto atualizada com as últimas mudanças.
Realizar teste de software,Executar testes no novo recurso desenvolvido e registrar os resultados.
Responder e-mails,Responder a todos os e-mails pendentes da equipe e clientes.
Planejar evento,Organizar detalhes para o evento da empresa incluindo local e convidados.
Fazer backup de dados,Realizar o backup dos dados importantes da equipe no servidor.
Analisar feedback,Revisar o feedback dos usuários e identificar áreas de melhoria.
Definir metas,Estabelecer metas para o próximo trimestre com a equipe.
Criar cronograma,Elaborar um cronograma detalhado para o projeto em andamento.
Conduzir pesquisa,Realizar uma pesquisa de mercado para identificar novas oportunidades.
Reunião de alinhamento,Reunir-se com a equipe para alinhar expectativas sobre o projeto.
Desenvolver protótipo,Construir um protótipo inicial do novo produto para testes.
Treinamento da equipe,Organizar uma sessão de treinamento sobre as novas ferramentas.
Fazer check-in com clientes,Entrar em contato com os clientes para verificar sua satisfação.
Revisar orçamento,Analisar o orçamento do projeto e ajustar conforme necessário.
Desenvolver plano de marketing,Criar um plano de marketing para o lançamento do produto.
Acompanhar progresso,Revisar o progresso do projeto e atualizar a equipe sobre os resultados.
Encerrar projeto,Preparar a documentação final e encerrar formalmente o projeto.
Atualizar site,Revisar e atualizar o conteúdo do site com informações recentes.
Organizar evento,Planejar e coordenar todos os aspectos de um evento corporativo.
Realizar auditoria,Executar uma auditoria financeira para garantir conformidade.
Criar apresentação,Desenvolver uma apresentação para a reunião trimestral de stakeholders.
Ajustar plano de ação,Revisar e ajustar o plano de ação com base no feedback da equipe.
Implementar feedback,Integrar feedback dos usuários nas próximas iterações do produto.
Lidar com fornecedores,Negociar contratos e prazos com fornecedores chave.
Realizar teste de produto,Conduzir testes no produto antes do lançamento oficial.
Preparar relatório mensal,Elaborar um relatório mensal de desempenho e resultados.
Fazer análise SWOT,Executar uma análise SWOT para identificar pontos fortes e fracos.
Desenvolver estratégia,Definir a estratégia de marketing para o próximo trimestre.
Revisar contratos,Verificar e atualizar os contratos com parceiros e fornecedores.
Treinamento da equipe,Organizar uma sessão de treinamento para novos colaboradores.
Análise de dados,Coletar e analisar dados de vendas para identificar tendências.
Reunião de feedback,Conduzir uma reunião com a equipe para discutir o progresso.
Criar campanha de mídia,Desenvolver uma campanha de mídia social para o novo produto.
Atualizar documentação,Revisar e atualizar a documentação técnica do projeto.
Planejar viagem,Organizar os detalhes da viagem para a conferência anual.
Revisar orçamento,Analisar e ajustar o orçamento anual da empresa.
Criar plano de negócios,Desenvolver um plano de negócios para uma nova linha de produtos.
Realizar pesquisa de mercado,Conduzir uma pesquisa para entender as necessidades dos clientes.
Lidar com reclamações,Gerenciar e resolver reclamações de clientes de forma eficaz.
Criar um cronograma,Desenvolver um cronograma para o projeto de desenvolvimento.
Acompanhar métricas,Monitorar e analisar métricas de desempenho da equipe.
Fazer benchmarking,Comparar os resultados da empresa com os melhores do setor.
Elaborar política interna,Definir e documentar novas políticas internas da empresa.
Revisar plano de marketing,Atualizar o plano de marketing com base nas novas pesquisas.
Preparar apresentação,Criar slides para a apresentação na conferência de tecnologia.
Fazer uma análise de risco,Identificar e avaliar riscos potenciais para o projeto.
Organizar eventos de networking,Planejar e organizar eventos de networking para os funcionários.
Desenvolver protótipo,Construir um protótipo funcional para a nova aplicação.
Revisar pesquisa de satisfação,Analisar os resultados da pesquisa de satisfação do cliente.
Criar um canal no YouTube,Estabelecer um canal para compartilhar conteúdo da empresa.
Planejar webinar,Organizar um webinar para educar os clientes sobre o produto.
Fazer análise de concorrência,Estudar os concorrentes e suas estratégias de mercado.
Criar newsletter mensal,Desenvolver e enviar uma newsletter mensal para os assinantes.
Revisar estratégia de vendas,Analisar e ajustar a estratégia de vendas atual.
Organizar feedback dos clientes,Coletar e organizar o feedback dos clientes para melhorias.
Revisar KPIs,Analisar e revisar os KPIs para a equipe de vendas.
Conduzir entrevista,Realizar entrevistas para preencher uma vaga aberta.
Ajustar plano de desenvolvimento,Modificar o plano de desenvolvimento com base no progresso atual.
Gerar leads,Identificar e qualificar leads para o time de vendas.
Preparar orçamento de projeto,Calcular e elaborar o orçamento para um novo projeto.
Fazer reunião de planejamento,Reunir-se com a equipe para planejar o próximo mês.
Lidar com questões legais,Resolver questões legais pendentes com assessoria jurídica.
Analisar feedback da equipe,Revisar e agir com base no feedback da equipe sobre projetos.
Atualizar site da empresa,Modificar e melhorar a interface do site corporativo.
Criar campanha de email marketing,Desenvolver uma campanha de email marketing para novos produtos.
Fazer revisão de literatura,Realizar uma pesquisa e revisão de literatura sobre tendências de mercado.
Criar conteúdo para blog,Escrever artigos para o blog da empresa sobre temas relevantes.
Desenvolver aplicativos,Trabalhar no desenvolvimento de novos aplicativos para a empresa.
Revisar processos internos,Analisar e otimizar os processos internos da empresa.
Organizar a comunicação,Definir e melhorar os canais de comunicação interna.
Preparar um caso de estudo,Desenvolver um estudo de caso sobre um cliente bem-sucedido.
Fazer auditoria de segurança,Realizar uma auditoria de segurança nos sistemas da empresa.
Atualizar políticas de segurança,Revisar e atualizar as políticas de segurança da informação.
Criar um plano de contingência,Desenvolver um plano de contingência para situações imprevistas.
Fazer análise de viabilidade,Analisar a viabilidade de um novo projeto ou iniciativa.
Revisar acordos de parceria,Verificar e ajustar os acordos com parceiros estratégicos.
